[
  {
    "conditions": [
      {
        "action": "propose_candidate",
        "feature": "strongest_unassigned_peak"
      },
      {
        "action": "confirm_or_reject",
        "feature": "weaker_companion_peaks"
      },
      {
        "action": "remove_from_remaining_peaks",
        "feature": "assigned_peak_set"
      }
    ],
    "explanation": "Iteratively assign a mineral only when the strong peak and weaker companion peaks form a consistent set.",
    "rule_id": "chapter7_general_iterative_identification",
    "source": {
      "chapter": "Identification of Clay Minerals and Associated Minerals",
      "figure": null,
      "page": 227,
      "quote_fragment": "strongest peak",
      "source_book": "X-Ray Diffraction and the Identification and Analysis of Clay Minerals",
      "source_full_title": "X-Ray Diffraction and the Identification and Analysis of Clay Minerals",
      "source_id": "moore_reynolds_chapter7_ocr_analises_pdf",
      "table": null
    },
    "target": "identification_workflow",
    "weight": 0.6
  },
  {
    "conditions": [
      {
        "feature": "oriented_aggregate",
        "required": true
      },
      {
        "feature": "basal_ool_series",
        "required": true
      }
    ],
    "explanation": "Clay-mineral identification should prioritize oriented-aggregate basal OOl series over random-powder strongest lines.",
    "rule_id": "chapter7_ool_series_required",
    "source": {
      "chapter": "Identification of Clay Minerals and Associated Minerals",
      "figure": null,
      "page": 228,
      "quote_fragment": "OOl",
      "source_book": "X-Ray Diffraction and the Identification and Analysis of Clay Minerals",
      "source_full_title": "X-Ray Diffraction and the Identification and Analysis of Clay Minerals",
      "source_id": "moore_reynolds_chapter7_ocr_analises_pdf",
      "table": null
    },
    "target": "clay_mineral_identification",
    "weight": 0.8
  },
  {
    "conditions": [
      {
        "d": 14.2,
        "feature": "peak",
        "reflection": "001",
        "tolerance": 0.5
      },
      {
        "d": 7.1,
        "feature": "peak",
        "reflection": "002",
        "tolerance": 0.25
      },
      {
        "d": 4.74,
        "feature": "peak",
        "reflection": "003",
        "tolerance": 0.12
      },
      {
        "d": 3.55,
        "feature": "peak",
        "reflection": "004",
        "tolerance": 0.08
      }
    ],
    "explanation": "Chlorite requires the persistent 14/7/4.74/3.55 A basal set, not only the 7 A overlap.",
    "rule_id": "chapter7_chlorite_ool",
    "source": {
      "chapter": "Identification of Clay Minerals and Associated Minerals",
      "figure": "7.4",
      "page": 234,
      "quote_fragment": "chlorite",
      "source_book": "X-Ray Diffraction and the Identification and Analysis of Clay Minerals",
      "source_full_title": "X-Ray Diffraction and the Identification and Analysis of Clay Minerals",
      "source_id": "moore_reynolds_chapter7_ocr_analises_pdf",
      "table": null
    },
    "target": "chlorite",
    "weight": 1.0
  },
  {
    "conditions": [
      {
        "d": 3.57,
        "feature": "kaolinite_002",
        "tolerance": 0.05
      },
      {
        "d": 3.53,
        "feature": "chlorite_004",
        "tolerance": 0.06
      },
      {
        "chlorite": "persists_or_001_increases",
        "feature": "heat_550c",
        "kaolinite": "disappears"
      }
    ],
    "explanation": "Resolve the 7 A overlap by 3.57/3.53 A companions and by heating response.",
    "rule_id": "chapter7_kaolinite_chlorite_resolution",
    "source": {
      "chapter": "Identification of Clay Minerals and Associated Minerals",
      "figure": null,
      "page": 234,
      "quote_fragment": "550°C",
      "source_book": "X-Ray Diffraction and the Identification and Analysis of Clay Minerals",
      "source_full_title": "X-Ray Diffraction and the Identification and Analysis of Clay Minerals",
      "source_id": "moore_reynolds_chapter7_ocr_analises_pdf",
      "table": null
    },
    "target": "kaolin_vs_chlorite",
    "weight": 1.0
  },
  {
    "conditions": [
      {
        "d_max": 15.5,
        "d_min": 12.0,
        "feature": "natural_001"
      },
      {
        "d": 16.9,
        "feature": "glycolated_001",
        "tolerance": 0.8
      },
      {
        "feature": "heated_or_k300",
        "response": "collapse_to_10A"
      }
    ],
    "explanation": "Smectite is supported by expansion after ethylene glycol and collapse toward 10 A after heating/K treatment.",
    "rule_id": "chapter7_smectite_ngc",
    "source": {
      "chapter": "Identification of Clay Minerals and Associated Minerals",
      "figure": "7.8",
      "page": 241,
      "quote_fragment": "glycol",
      "source_book": "X-Ray Diffraction and the Identification and Analysis of Clay Minerals",
      "source_full_title": "X-Ray Diffraction and the Identification and Analysis of Clay Minerals",
      "source_id": "moore_reynolds_chapter7_ocr_analises_pdf",
      "table": null
    },
    "target": "smectite",
    "weight": 1.0
  },
  {
    "conditions": [
      {
        "d": 14.5,
        "feature": "natural_001",
        "tolerance": 0.8
      },
      {
        "feature": "glycerol_response",
        "response": "retains_14_5A"
      },
      {
        "feature": "heated_or_k300",
        "response": "collapses_to_10A"
      }
    ],
    "explanation": "Vermiculite is an operational diagnosis; use glycerol/K/heating to separate it from smectite and chlorite.",
    "rule_id": "chapter7_vermiculite_operational",
    "source": {
      "chapter": "Identification of Clay Minerals and Associated Minerals",
      "figure": "7.7",
      "page": 240,
      "quote_fragment": "glycerol",
      "source_book": "X-Ray Diffraction and the Identification and Analysis of Clay Minerals",
      "source_full_title": "X-Ray Diffraction and the Identification and Analysis of Clay Minerals",
      "source_id": "moore_reynolds_chapter7_ocr_analises_pdf",
      "table": null
    },
    "target": "vermiculite",
    "weight": 0.85
  },
  {
    "conditions": [
      {
        "d": 10.0,
        "feature": "peak",
        "reflection": "001",
        "tolerance": 0.4
      },
      {
        "feature": "treatment_response",
        "glycol": "unchanged",
        "heated_550c": "unchanged"
      },
      {
        "feature": "d060",
        "role": "separate_dioctahedral_trioctahedral"
      }
    ],
    "explanation": "Illite/glauconite/mica-like phases preserve 10 A through glycolation/heating; d060 helps separate mica types.",
    "rule_id": "chapter7_illite_glauconite_mica",
    "source": {
      "chapter": "Identification of Clay Minerals and Associated Minerals",
      "figure": "7.3",
      "page": 233,
      "quote_fragment": "illite",
      "source_book": "X-Ray Diffraction and the Identification and Analysis of Clay Minerals",
      "source_full_title": "X-Ray Diffraction and the Identification and Analysis of Clay Minerals",
      "source_id": "moore_reynolds_chapter7_ocr_analises_pdf",
      "table": null
    },
    "target": "illite_mica",
    "weight": 0.8
  },
  {
    "conditions": [
      {
        "feature": "low_angle_peak",
        "palygorskite": "10.3-10.5A",
        "sepiolite": "12-12.5A"
      },
      {
        "feature": "glycol_response",
        "response": "unchanged"
      },
      {
        "feature": "morphology",
        "importance": "strong_auxiliary",
        "value": "fibrous_or_tubular"
      }
    ],
    "explanation": "Fibrous/channel minerals need morphology and hkl checks because low-angle peaks overlap expandable clays.",
    "rule_id": "chapter7_fibrous_channel_minerals",
    "source": {
      "chapter": "Identification of Clay Minerals and Associated Minerals",
      "figure": null,
      "page": 244,
      "quote_fragment": "fibrous",
      "source_book": "X-Ray Diffraction and the Identification and Analysis of Clay Minerals",
      "source_full_title": "X-Ray Diffraction and the Identification and Analysis of Clay Minerals",
      "source_id": "moore_reynolds_chapter7_ocr_analises_pdf",
      "table": "7.3"
    },
    "target": "sepiolite_palygorskite_halloysite",
    "weight": 0.7
  },
  {
    "conditions": [
      {
        "d": 3.34,
        "feature": "quartz_101",
        "tolerance": 0.06
      },
      {
        "d": 4.26,
        "feature": "quartz_100",
        "tolerance": 0.1
      },
      {
        "feature": "role",
        "value": "internal_standard_and_competitor"
      }
    ],
    "explanation": "Quartz can calibrate peak positions and competes with illite 3.33 A and d060-like regions.",
    "rule_id": "chapter7_quartz_internal_standard",
    "source": {
      "chapter": "Identification of Clay Minerals and Associated Minerals",
      "figure": null,
      "page": 227,
      "quote_fragment": "quartz",
      "source_book": "X-Ray Diffraction and the Identification and Analysis of Clay Minerals",
      "source_full_title": "X-Ray Diffraction and the Identification and Analysis of Clay Minerals",
      "source_id": "moore_reynolds_chapter7_ocr_analises_pdf",
      "table": null
    },
    "target": "quartz",
    "weight": 0.6
  }
]
